### ISSUE TITLE
No networking on freshly created Fedora 32 containers

### ISSUE THREAD

**Issue by pevogam** [lxc/lxc#3481]
Hi, I am having trouble setting up Fedora 32 containers while still managing to set up Fedora 31 ones just fine.

# Required information

 * Distribution: CentOS 8
 * Distribution version: LXC3.0
 * The output of
   * `lxc-start --version`

```
3.0.4
```

   * `lxc-checkconfig`

```
Kernel configuration not found at /proc/config.gz; searching...
Kernel configuration found at /boot/config-4.18.0-147.8.1.el8_1.x86_64
--- Namespaces ---
Namespaces: enabled
Utsname namespace: enabled
Ipc namespace: enabled
Pid namespace: enabled
User namespace: enabled
Warning: newuidmap is not setuid-root
Warning: newgidmap is not setuid-root
Network namespace: enabled

--- Control groups ---
Cgroups: enabled

Cgroup v1 mount points: 
/sys/fs/cgroup/systemd
/sys/fs/cgroup/rdma
/sys/fs/cgroup/cpu,cpuacct
/sys/fs/cgroup/blkio
/sys/fs/cgroup/perf_event
/sys/fs/cgroup/pids
/sys/fs/cgroup/cpuset
/sys/fs/cgroup/devices
/sys/fs/cgroup/freezer
/sys/fs/cgroup/net_cls,net_prio
/sys/fs/cgroup/hugetlb
/sys/fs/cgroup/memory

Cgroup v2 mount points: 


Cgroup v1 clone_children flag: enabled
Cgroup device: enabled
Cgroup sched: enabled
Cgroup cpu account: enabled
Cgroup memory controller: enabled
Cgroup cpuset: enabled

--- Misc ---
Veth pair device: enabled, loaded
Macvlan: enabled, not loaded
Vlan: enabled, not loaded
Bridges: enabled, loaded
Advanced netfilter: enabled, loaded
CONFIG_NF_NAT_IPV4: enabled, loaded
CONFIG_NF_NAT_IPV6: enabled, loaded
CONFIG_IP_NF_TARGET_MASQUERADE: enabled, not loaded
CONFIG_IP6_NF_TARGET_MASQUERADE: enabled, not loaded
CONFIG_NETFILTER_XT_TARGET_CHECKSUM: enabled, loaded
CONFIG_NETFILTER_XT_MATCH_COMMENT: enabled, not loaded
FUSE (for use with lxcfs): enabled, not loaded

--- Checkpoint/Restore ---
checkpoint restore: enabled
CONFIG_FHANDLE: enabled
CONFIG_EVENTFD: enabled
CONFIG_EPOLL: enabled
CONFIG_UNIX_DIAG: enabled
CONFIG_INET_DIAG: enabled
CONFIG_PACKET_DIAG: enabled
CONFIG_NETLINK_DIAG: enabled
File capabilities: 

Note : Before booting a new kernel, you can check its configuration
usage : CONFIG=/path/to/config /usr/bin/lxc-checkconfig
```

   * `cat /proc/1/mounts`

```
sysfs /sys sysfs rw,seclabel,nosuid,nodev,noexec,relatime 0 0
proc /proc proc rw,nosuid,nodev,noexec,relatime 0 0
devtmpfs /dev devtmpfs rw,seclabel,nosuid,size=12061632k,nr_inodes=3015408,mode=755 0 0
securityfs /sys/kernel/security securityfs rw,nosuid,nodev,noexec,relatime 0 0
tmpfs /dev/shm tmpfs rw,seclabel,nosuid,nodev 0 0
devpts /dev/pts devpts rw,seclabel,nosuid,noexec,relatime,gid=5,mode=620,ptmxmode=000 0 0
tmpfs /run tmpfs rw,seclabel,nosuid,nodev,mode=755 0 0
tmpfs /sys/fs/cgroup tmpfs ro,seclabel,nosuid,nodev,noexec,mode=755 0 0
cgroup /sys/fs/cgroup/systemd cgroup rw,seclabel,nosuid,nodev,noexec,relatime,xattr,release_agent=/usr/lib/systemd/systemd-cgroups-agent,name=systemd 0 0
pstore /sys/fs/pstore pstore rw,seclabel,nosuid,nodev,noexec,relatime 0 0
bpf /sys/fs/bpf bpf rw,nosuid,nodev,noexec,relatime,mode=700 0 0
cgroup /sys/fs/cgroup/rdma cgroup rw,seclabel,nosuid,nodev,noexec,relatime,rdma 0 0
cgroup /sys/fs/cgroup/cpu,cpuacct cgroup rw,seclabel,nosuid,nodev,noexec,relatime,cpu,cpuacct 0 0
cgroup /sys/fs/cgroup/blkio cgroup rw,seclabel,nosuid,nodev,noexec,relatime,blkio 0 0
cgroup /sys/fs/cgroup/perf_event cgroup rw,seclabel,nosuid,nodev,noexec,relatime,perf_event 0 0
cgroup /sys/fs/cgroup/pids cgroup rw,seclabel,nosuid,nodev,noexec,relatime,pids 0 0
cgroup /sys/fs/cgroup/cpuset cgroup rw,seclabel,nosuid,nodev,noexec,relatime,cpuset 0 0
cgroup /sys/fs/cgroup/devices cgroup rw,seclabel,nosuid,nodev,noexec,relatime,devices 0 0
cgroup /sys/fs/cgroup/freezer cgroup rw,seclabel,nosuid,nodev,noexec,relatime,freezer 0 0
cgroup /sys/fs/cgroup/net_cls,net_prio cgroup rw,seclabel,nosuid,nodev,noexec,relatime,net_cls,net_prio 0 0
cgroup /sys/fs/cgroup/hugetlb cgroup rw,seclabel,nosuid,nodev,noexec,relatime,hugetlb 0 0
cgroup /sys/fs/cgroup/memory cgroup rw,seclabel,nosuid,nodev,noexec,relatime,memory 0 0
configfs /sys/kernel/config configfs rw,relatime 0 0
/dev/mapper/cl-root / xfs rw,seclabel,relatime,attr2,inode64,noquota 0 0
selinuxfs /sys/fs/selinux selinuxfs rw,relatime 0 0
systemd-1 /proc/sys/fs/binfmt_misc autofs rw,relatime,fd=41,pgrp=1,timeout=0,minproto=5,maxproto=5,direct,pipe_ino=16067 0 0
mqueue /dev/mqueue mqueue rw,seclabel,relatime 0 0
debugfs /sys/kernel/debug debugfs rw,seclabel,relatime 0 0
hugetlbfs /dev/hugepages hugetlbfs rw,seclabel,relatime,pagesize=2M 0 0
/dev/mapper/cl-root /var/cache/fscache xfs rw,seclabel,relatime,attr2,inode64,noquota 0 0
/dev/mapper/cl-home /home xfs rw,seclabel,relatime,attr2,inode64,noquota 0 0
/dev/sda1 /boot ext4 rw,seclabel,relatime 0 0
sunrpc /var/lib/nfs/rpc_pipefs rpc_pipefs rw,relatime 0 0
tmpfs /run/user/42 tmpfs rw,seclabel,nosuid,nodev,relatime,size=2415804k,mode=700,uid=42,gid=42 0 0
tmpfs /run/user/1000 tmpfs rw,seclabel,nosuid,nodev,relatime,size=2415804k,mode=700,uid=1000,gid=1000 0 0
```

# Issue description

I no longer have networking on the container itself after downloading a Fedora 32 container using

```
$ sudo lxc-create -t download -n c1 -- --dist fedora --release 32 --arch amd64
Setting up the GPG keyring
Downloading the image index
Downloading the rootfs
Downloading the metadata
The image cache is now ready
Unpacking the rootfs

---
You just created a Fedora 32 x86_64 (20200707_20:33) container.
```

Some debugging reveals the following problems:

```
$ sudo lxc-start -d -n c1
$ sudo lxc-attach -n c1
[root@c1 /]# ip a
1: lo: <LOOPBACK,UP,LOWER_UP> mtu 65536 qdisc noqueue state UNKNOWN group default qlen 1000
    link/loopback 00:00:00:00:00:00 brd 00:00:00:00:00:00
    inet 127.0.0.1/8 scope host lo
       valid_lft forever preferred_lft forever
    inet6 ::1/128 scope host 
       valid_lft forever preferred_lft forever
15: eth0@if16: <BROADCAST,MULTICAST,UP,LOWER_UP> mtu 1500 qdisc noqueue state UP group default qlen 1000
    link/ether 00:16:3e:d7:d0:56 brd ff:ff:ff:ff:ff:ff link-netnsid 0
    inet6 fe80::216:3eff:fed7:d056/64 scope link 
       valid_lft forever preferred_lft forever
[root@c1 /]# networkctl status --all
● 1: lo                                                 
             Link File: n/a                             
          Network File: n/a                             
                  Type: loopback                        
                 State: carrier (unmanaged)
                   MTU: 65536                           
  Queue Length (Tx/Rx): 1/1                             
               Address: 127.0.0.1                       
                        ::1                             

● 15: eth0                                                        
                  
             Link File: n/a                                                     
    
          Network File: /etc/systemd/network/eth0.network                       
    
                  Type: ether                                                   
    
                 State: degraded (configuring)
            HW Address: 00:16:3e:d7:d0:56 (Xensource, Inc.)                     
    
                   MTU: 1500                                                    
    
  Queue Length (Tx/Rx): 1/1                                                     
    
      Auto negotiation: no                                                      
    
                 Speed: 10Gbps                                                  
    
                Duplex: full                                                    
    
                  Port: tp                                                      
    
               Address: fe80::216:3eff:fed7:d056                                
    

Jul 08 11:30:55 c1 systemd-networkd[34]: eth0: IPv6 successfully enabled
Jul 08 11:30:56 c1 systemd-networkd[34]: eth0: Gained IPv6LL
[root@c1 /]# journalctl | grep sysctl
Jul 08 11:30:55 c1 systemd-sysctl[22]: Not setting net/ipv4/conf/all/rp_filter (explicit setting exists).
Jul 08 11:30:55 c1 systemd-sysctl[22]: Not setting net/ipv4/conf/default/rp_filter (explicit setting exists).
Jul 08 11:30:55 c1 systemd-sysctl[22]: Not setting net/ipv4/conf/all/accept_source_route (explicit setting exists).
Jul 08 11:30:55 c1 systemd-sysctl[22]: Not setting net/ipv4/conf/default/accept_source_route (explicit setting exists).
Jul 08 11:30:55 c1 systemd-sysctl[22]: Not setting net/ipv4/conf/all/promote_secondaries (explicit setting exists).
Jul 08 11:30:55 c1 systemd-sysctl[22]: Not setting net/ipv4/conf/default/promote_secondaries (explicit setting exists).
Jul 08 11:30:55 c1 systemd-sysctl[22]: Couldn't write 'fq_codel' to 'net/core/default_qdisc', ignoring: No such file or directory
Jul 08 11:30:55 c1 systemd-sysctl[22]: Couldn't write '1' to 'fs/protected_regular', ignoring: No such file or directory
Jul 08 11:30:55 c1 systemd-sysctl[22]: Couldn't write '1' to 'fs/protected_fifos', ignoring: No such file or directory
Jul 08 11:30:55 c1 systemd-sysctl[22]: Couldn't write '81920' to 'net/core/optmem_max', ignoring: No such file or directory
```

so it seems like some issue with `net/core/default_qdisc` resulting in a degraded state of the network inferface.

Has anyone else seen this? I can provide any further information upon request.

**Comment by stgraber** [comment]
Can you show `systemctl --failed` inside the container and `dmesg` outside?

**Comment by pevogam** [comment]
Sure,

```
[root@c1 /]# systemctl --failed
  UNIT                                 LOAD   ACTIVE SUB  
  DESCRIPTION                      
● systemd-networkd-wait-online.service loaded failed f
ailed Wait for Network to be Configured

LOAD   = Reflects whether the unit definition was properly loaded.
ACTIVE = The high-level unit activation state, i.e. generalization of SUB.
SUB    = The low-level unit activation state, values depend on unit type.

1 loaded units listed.
```

and

```
[  344.720218] lxcbr0: port 1(vethN26TZP) entered blocking state
[  344.720220] lxcbr0: port 1(vethN26TZP) entered disabled state
[  344.720255] device vethN26TZP entered promiscuous mode
[  344.720365] IPv6: ADDRCONF(NETDEV_UP): vethN26TZP: link is not ready
[  344.720366] lxcbr0: port 1(vethN26TZP) entered blocking state
[  344.720367] lxcbr0: port 1(vethN26TZP) entered listening state
[  344.727796] lxcbr0: port 1(vethN26TZP) entered disabled state
[  344.728878] eth0: renamed from veth7V9OZX
[  344.736017] IPv6: ADDRCONF(NETDEV_UP): eth0: link is not ready
[  344.736842] IPv6: ADDRCONF(NETDEV_CHANGE): eth0: link becomes ready
[  344.736858] IPv6: ADDRCONF(NETDEV_CHANGE): vethN26TZP: link becomes ready
[  344.736880] lxcbr0: port 1(vethN26TZP) entered blocking state
[  344.736881] lxcbr0: port 1(vethN26TZP) entered listening state
[  345.026785] Using feature eBPF/cgroup.
[  345.313211] SELinux: unrecognized netlink message: protocol=0 nlmsg_type=106 sclass=netlink_route_socket pig=4335 comm=systemd-network
[  360.172837] lxcbr0: port 1(vethN26TZP) entered learning state
```

However, the first output takes a while to appear after the issue is already encountered and might rather be irrelevant.

**Comment by stgraber** [comment]
that SELinux error is suspicious there.
Any chance you could completely disable SELinux, reboot the system and try again?

If that works, then you're dealing with a SELinux bug/limitation on that kernel.

**Comment by pevogam** [comment]
For a moment I thought the same but then I remember that I obtain this issue also on other platforms with SELinux disabled. Nevertheless, I just disabled as

```
$sudo setenforce 0
$ sestatus
SELinux status:                 enabled
SELinuxfs mount:                /sys/fs/selinux
SELinux root directory:         /etc/selinux
Loaded policy name:             targeted
Current mode:                   permissive
Mode from config file:          enforcing
Policy MLS status:              enabled
Policy deny_unknown status:     allowed
Memory protection checking:     actual (secure)
Max kernel policy version:      31

-> then redid to get the same output

Is there any obvious reason what could cause this other than SELinux?

**Comment by pevogam** [comment]
I am also wondering, is this reproducible with an F32 container by anyone else? We get this both on CentOS 8, CentOS 7, and Fedora 32 container hosts.

**Comment by stgraber** [comment]
I'm not sure that permissive would be enough to test this, you're hitting a kernel error there, not a policy error.

So I'd recommend completely disabling SELinux and testing it that way.

**Comment by pevogam** [comment]
Good point, I tried with disabled and the only difference is that the SELinux message is no longer there:

```
$ sestatus
SELinux status:                 disabled
$ dmesg
[   41.790217] lxcbr0: port 1(veth1KQUUR) entered blocking state
[   41.790218] lxcbr0: port 1(veth1KQUUR) entered disabled state
[   41.790251] device veth1KQUUR entered promiscuous mode
[   41.790329] IPv6: ADDRCONF(NETDEV_UP): veth1KQUUR: link is not ready
[   41.790330] lxcbr0: port 1(veth1KQUUR) entered blocking state
[   41.790331] lxcbr0: port 1(veth1KQUUR) entered listening state
[   41.791134] lxcbr0: port 1(veth1KQUUR) entered disabled state
[   41.811919] eth0: renamed from vethQI109C
[   41.816352] IPv6: ADDRCONF(NETDEV_UP): eth0: link is not ready
[   41.816708] IPv6: ADDRCONF(NETDEV_CHANGE): eth0: link becomes ready
[   41.816724] IPv6: ADDRCONF(NETDEV_CHANGE): veth1KQUUR: link becomes ready
[   41.816745] lxcbr0: port 1(veth1KQUUR) entered blocking state
[   41.816747] lxcbr0: port 1(veth1KQUUR) entered listening state
[   42.111290] Using feature eBPF/cgroup.
[   57.037488] lxcbr0: port 1(veth1KQUUR) entered learning state
```

**Comment by stgraber** [comment]
Ok, guess we can rule that out then :)

Any chance you can `tcpdump` the bridge on the host to see what networkd does on the network?

**Comment by pevogam** [comment]
It seems that we get numerous DHCP requests without replies:

```
12:16:01.996405 IP 0.0.0.0.bootpc > 255.255.255.255.bootps: BOOTP/DHCP, Request from 00:16:3e:d7:d0:56 (oui Unknown), length 284
12:17:06.478849 IP 0.0.0.0.bootpc > 255.255.255.255.bootps: BOOTP/DHCP, Request from 00:16:3e:d7:d0:56 (oui Unknown), length 284
12:17:27.895699 IP6 fe80::216:3eff:fed7:d056 > ff02::2: ICMP6, router solicitation, length 16
12:18:09.966591 IP 0.0.0.0.bootpc > 255.255.255.255.bootps: BOOTP/DHCP, Request from 00:16:3e:d7:d0:56 (oui Unknown), length 284
12:19:14.290411 IP 0.0.0.0.bootpc > 255.255.255.255.bootps: BOOTP/DHCP, Request from 00:16:3e:d7:d0:56 (oui Unknown), length 284
12:20:17.647905 IP 0.0.0.0.bootpc > 255.255.255.255.bootps: BOOTP/DHCP, Request from 00:16:3e:d7:d0:56 (oui Unknown), length 284
12:21:22.270825 IP 0.0.0.0.bootpc > 255.255.255.255.bootps: BOOTP/DHCP, Request from 00:16:3e:d7:d0:56 (oui Unknown), length 284
12:22:27.239800 IP 0.0.0.0.bootpc > 255.255.255.255.bootps: BOOTP/DHCP, Request from 00:16:3e:d7:d0:56 (oui Unknown), length 284
```

The same DHCP requests I get also for a working F31 container. However, note that I am not providing DHCP and using static IP with two additional lines in the container config:

```
# Additional network configuration
lxc.net.0.ipv4.address = 192.168.255.1/24
lxc.net.0.ipv4.gateway = 192.168.255.254
```

Here is the full config for your reference:

```
# Template used to create this container: /usr/share/lxc/templates/lxc-download
# Parameters passed to the template: --dist fedora --release 32 --arch amd64
# For additional config options, please look at lxc.container.conf(5)

# Uncomment the following line to support nesting containers:
#lxc.include = /usr/share/lxc/config/nesting.conf
# (Be aware this has security implications)


# Distribution configuration
lxc.include = /usr/share/lxc/config/common.conf
lxc.arch = x86_64

# Container specific configuration
lxc.rootfs.path = dir:/var/lib/lxc/c1/rootfs
lxc.uts.name = c1

# Network configuration
lxc.net.0.type = veth
lxc.net.0.link = lxcbr0
lxc.net.0.flags = up
lxc.net.0.hwaddr = 00:16:3e:d7:d0:56

# Additional network configuration
lxc.net.0.ipv4.address = 192.168.255.1/24
lxc.net.0.ipv4.gateway = 192.168.255.254
```

and host is completely pingable

```
$ ping 192.168.255.254
PING 192.168.255.254 (192.168.255.254) 56(84) bytes of data.
64 bytes from 192.168.255.254: icmp_seq=1 ttl=64 time=0.050 ms
64 bytes from 192.168.255.254: icmp_seq=2 ttl=64 time=0.043 ms
$ ip a show dev lxcbr0
3: lxcbr0: <BROADCAST,MULTICAST,UP,LOWER_UP> mtu 1500 qdisc noqueue state UP group default qlen 1000
    link/ether fe:de:be:aa:d7:b1 brd ff:ff:ff:ff:ff:ff
    inet 192.168.255.254/24 brd 192.168.255.255 scope global noprefixroute lxcbr0
       valid_lft forever preferred_lft forever
```

Also note that the problem I am describing is not about internet connectivity which could require additional firewall rules but specifically about the fact that despite having a static IP address, the container never really sets the address correctly.

This is F32 container

```
[root@c1 /]# ip a
1: lo: <LOOPBACK,UP,LOWER_UP> mtu 65536 qdisc noqueue state UNKNOWN group default qlen 1000
    link/loopback 00:00:00:00:00:00 brd 00:00:00:00:00:00
    inet 127.0.0.1/8 scope host lo
       valid_lft forever preferred_lft forever
    inet6 ::1/128 scope host 
       valid_lft forever preferred_lft forever
7: eth0@if8: <BROADCAST,MULTICAST,UP,LOWER_UP> mtu 1500 qdisc noqueue state UP group default qlen 1000
    link/ether 00:16:3e:d7:d0:56 brd ff:ff:ff:ff:ff:ff link-netnsid 0
    inet6 fe80::216:3eff:fed7:d056/64 scope link 
       valid_lft forever preferred_lft forever
```

and this is a working F31 container

```
[root@c10 /]# ip a
1: lo: <LOOPBACK,UP,LOWER_UP> mtu 65536 qdisc noqueue state UNKNOWN group default qlen 1000
    link/loopback 00:00:00:00:00:00 brd 00:00:00:00:00:00
    inet 127.0.0.1/8 scope host lo
       valid_lft forever preferred_lft forever
    inet6 ::1/128 scope host 
       valid_lft forever preferred_lft forever
61: eth0@if62: <BROADCAST,MULTICAST,UP,LOWER_UP> mtu 1500 qdisc noqueue state UP group default qlen 1000
    link/ether de:83:a6:bb:cc:85 brd ff:ff:ff:ff:ff:ff link-netnsid 0
    inet 192.168.255.10/24 brd 192.168.255.255 scope global eth0
       valid_lft forever preferred_lft forever
    inet6 fe80::d0d7:33ff:fee6:7b04/64 scope link 
       valid_lft forever preferred_lft forever
```

**Comment by stgraber** [comment]
Ah, okay, then that makes sense.

In LXC such static config is applied to the network namespace before starting the container. If the container then resets the interface (as networkd is doing here), this gets lost.

Your two options are:
 - Disable networkd completely in the container (this should then show you the pre-configured address)
 - Set the static address through networkd in the container instead

It's known that some versions of some distros would keep pre-existing config while some aren't, it's just not a widely supported thing by distros and is very much hit and miss.

**Comment by pevogam** [comment]
Thanks @stgraber, this was indeed the culprit.
