### ISSUE TITLE
Update `lxc-net` to support nftables

### ISSUE THREAD

**Issue by Forbinn** [lxc/lxc#3093]
I'm currently creating a new container on a fresh server and I'm facing a network issue. Basically the container cannot reach anything on the Internet i.e. every request timeout.

Here are the information related to the host and the lxc configuration:

 - `uname -a` output on the server: `Linux prodserver02 4.9.185-xxxx-std-ipv6-64 #799710 SMP Wed Jul 10 08:31:28 UTC 2019 x86_64 GNU/Linux`.
 - OS: `Debian 9`
 - Container created using: `lxc-create -n test -t download -- -d debian -r buster -a amd64`
 - `cat /proc/sys/net/ipv4/ip_forward`: `1`
 - `lxc-ls --version`: `3.0.3`
 - `lxc-checkconfig`: [lxc-checkconfig-output.txt](https://github.com/lxc/lxc/files/3402682/lxc-checkconfig-output.txt)
 - `cat /etc/lxc/lxc.conf`:
```
lxc.lxcpath = /home/lxc
```
 - `cat /etc/default/lxc-net`: 
```
USE_LXC_BRIDGE="true"
LXC_BRIDGE="lxc-bridge-nat"
LXC_ADDR="192.168.100.1"
LXC_NETMASK="255.255.255.0"
LXC_NETWORK="192.168.100.0/24"
LXC_DHCP_RANGE="192.168.100.2,192.168.100.254"
LXC_DHCP_MAX="253"
LXC_DHCP_CONFILE=""
LXC_DOMAIN="lxc"

LXC_IPV6_ADDR="fc27::216:3eff:fe00:1"
LXC_IPV6_MASK="64"
LXC_IPV6_NETWORK="fc27::/64"
LXC_IPV6_NAT="true"
```
 - `cat /home/lxc/test/config`
```
# Template used to create this container: /usr/share/lxc/templates/lxc-download
# Parameters passed to the template: -d debian -r buster -a amd64
# Template script checksum (SHA-1): 273c51343604eb85f7e294c8da0a5eb769d648f3
# For additional config options, please look at lxc.container.conf(5)

# Uncomment the following line to support nesting containers:
#lxc.include = /usr/share/lxc/config/nesting.conf
# (Be aware this has security implications)

# Auto start configuration
# Mount shared folder so the container can access letsencrypt certificates
# into its own /share folder

# Distribution configuration
lxc.include = /usr/share/lxc/config/common.conf
lxc.arch = linux64

# Container specific configuration
lxc.start.auto = 1
lxc.rootfs.path = dir:/home/lxc/test/rootfs
lxc.uts.name = test

# Network configuration
lxc.net.0.type  = veth
lxc.net.0.flags = up
lxc.net.0.link  = lxc-bridge-nat
```

- [lxc-start-output.txt](https://github.com/lxc/lxc/files/3402667/lxc-start-output.txt)

With this setup I can successfully ping the container or the host from the container through the `lxc-bridge-nat` interface. But inside the container the command `ping 8.8.8.8` does not give any results:
```
PING 8.8.8.8 (8.8.8.8): 56 data bytes
^C--- 8.8.8.8 ping statistics ---
18 packets transmitted, 0 packets received, 100% packet loss
```

 -  [iptables-save-output.txt](https://github.com/lxc/lxc/files/3402681/iptables-save-output.txt)
 - [iptables-raw-output.txt](https://github.com/lxc/lxc/files/3402675/iptables-raw-output.txt)

I have also tried the `tcpdump -i eno1 -n icmp` command to see if there was any issue related to the IP packet and here is the output (It has been run on the host side during a ping to 8.8.8.8 on the container side):
```
tcpdump: verbose output suppressed, use -v or -vv for full protocol decode
listening on eno1, link-type EN10MB (Ethernet), capture size 262144 bytes
11:12:38.938243 IP 192.168.100.78 > 8.8.8.8: ICMP echo request, id 1137, seq 0, length 64
11:12:39.939343 IP 192.168.100.78 > 8.8.8.8: ICMP echo request, id 1137, seq 1, length 64
11:12:40.940554 IP 192.168.100.78 > 8.8.8.8: ICMP echo request, id 1137, seq 2, length 64
11:12:41.941748 IP 192.168.100.78 > 8.8.8.8: ICMP echo request, id 1137, seq 3, length 64
11:12:42.942939 IP 192.168.100.78 > 8.8.8.8: ICMP echo request, id 1137, seq 4, length 64
```

Has you can see the packet goes on the Internet through the public interface but it is using the IP address of the container and not the host.

So I assume my issue is related to that but I don't know why it does that and how to fix it.

If you need any more information in order to solve my problem, feel free to ask.

The template below is mostly useful for bug reports and support questions.
Feel free to remove anything which doesn't apply to you and add more information where it makes sense.

**Comment by Forbinn** [comment]
Ok, I found the issue (thank to tomp on https://discuss.linuxcontainers.org). By default lxc-net uses `iptables` to create rules which is fine but not working on my system because `# Warning: iptables-legacy tables present, use iptables-legacy to see them`.

So after executing the command `iptables-legacy -t nat -A POSTROUTING -s 192.168.100.0/24 ! -d 192.168.100.0/24 -j MASQUERADE` the system now works fine.

I now have two little more questions regarding this issue: why is this the case ? And how can I make this work using the non-legacy system ?

**Comment by brauner** [comment]
@stgraber ?

**Comment by stgraber** [comment]
Not sure, though we probably ought to make this issue about supporting `nft` directly.
We can probably get @tomponline to update the script to support both, similar to what we did for LXD.

**Comment by comannnnndooooo** [comment]
Starting to work on this issue if thats all right.

**Comment by tomponline** [comment]
Thanks!

**Comment by stgraber** [comment]
Yup, assigned it to you!
