### ISSUE TITLE
Cannot get ip address

### ISSUE THREAD

**Issue by sebelk** [lxc/lxc#3394]
# Required information

 * Distribution: CentOS (on VirtualBox)
 * Distribution version: 
 * The output of
   * `lxc-start --version`
   3.0.4
   * `lxc-checkconfig`
 ````
Kernel configuration not found at /proc/config.gz; searching...
Kernel configuration found at /boot/config-4.18.0-147.8.1.el8_1.x86_64
--- Namespaces ---
Namespaces: enabled
Utsname namespace: enabled
Ipc namespace: enabled
Pid namespace: enabled
User namespace: enabled
Warning: newuidmap is not setuid-root
Warning: newgidmap is not setuid-root
Network namespace: enabled

--- Control groups ---
Cgroups: enabled

Cgroup v1 mount points: 
/sys/fs/cgroup/systemd
/sys/fs/cgroup/cpu,cpuacct
/sys/fs/cgroup/memory
/sys/fs/cgroup/net_cls,net_prio
/sys/fs/cgroup/blkio
/sys/fs/cgroup/devices
/sys/fs/cgroup/freezer
/sys/fs/cgroup/perf_event
/sys/fs/cgroup/cpuset
/sys/fs/cgroup/rdma
/sys/fs/cgroup/hugetlb
/sys/fs/cgroup/pids

Cgroup v2 mount points: 


Cgroup v1 clone_children flag: enabled
Cgroup device: enabled
Cgroup sched: enabled
Cgroup cpu account: enabled
Cgroup memory controller: enabled
Cgroup cpuset: enabled

--- Misc ---
Veth pair device: enabled, loaded
Macvlan: enabled, not loaded
Vlan: enabled, not loaded
Bridges: enabled, loaded
Advanced netfilter: enabled, loaded
CONFIG_NF_NAT_IPV4: enabled, loaded
CONFIG_NF_NAT_IPV6: enabled, loaded
CONFIG_IP_NF_TARGET_MASQUERADE: enabled, not loaded
CONFIG_IP6_NF_TARGET_MASQUERADE: enabled, not loaded
CONFIG_NETFILTER_XT_TARGET_CHECKSUM: enabled, loaded
CONFIG_NETFILTER_XT_MATCH_COMMENT: enabled, not loaded
FUSE (for use with lxcfs): enabled, not loaded

--- Checkpoint/Restore ---
checkpoint restore: enabled
CONFIG_FHANDLE: enabled
CONFIG_EVENTFD: enabled
CONFIG_EPOLL: enabled
CONFIG_UNIX_DIAG: enabled
CONFIG_INET_DIAG: enabled
CONFIG_PACKET_DIAG: enabled
CONFIG_NETLINK_DIAG: enabled
File capabilities: 

Note : Before booting a new kernel, you can check its configuration
usage : CONFIG=/path/to/config /usr/bin/lxc-checkconfig
````

   * `uname -a`
 
 `Linux localhost.localdomain 4.18.0-147.8.1.el8_1.x86_64 #1 SMP Thu Apr 9 13:49:54 UTC 2020 x86_64 x86_64 x86_64 GNU/Linux`

   * `cat /proc/self/cgroup`

 ~~~~
 12:pids:/user.slice/user-1000.slice/session-3.scope
11:hugetlb:/
10:rdma:/
9:cpuset:/
8:perf_event:/
7:freezer:/
6:devices:/system.slice/sshd.service
5:blkio:/system.slice/sshd.service
4:net_cls,net_prio:/
3:memory:/user.slice/user-1000.slice/session-3.scope
2:cpu,cpuacct:/
1:name=systemd:/user.slice/user-1000.slice/session-3.scope
0::/
~~~~

   * `cat /proc/1/mounts`

```
sysfs /sys sysfs rw,seclabel,nosuid,nodev,noexec,relatime 0 0
proc /proc proc rw,nosuid,nodev,noexec,relatime 0 0
devtmpfs /dev devtmpfs rw,seclabel,nosuid,size=919004k,nr_inodes=229751,mode=755 0 0
securityfs /sys/kernel/security securityfs rw,nosuid,nodev,noexec,relatime 0 0
tmpfs /dev/shm tmpfs rw,seclabel,nosuid,nodev 0 0
devpts /dev/pts devpts rw,seclabel,nosuid,noexec,relatime,gid=5,mode=620,ptmxmode=000 0 0
tmpfs /run tmpfs rw,seclabel,nosuid,nodev,mode=755 0 0
tmpfs /sys/fs/cgroup tmpfs ro,seclabel,nosuid,nodev,noexec,mode=755 0 0
cgroup /sys/fs/cgroup/systemd cgroup rw,seclabel,nosuid,nodev,noexec,relatime,xattr,release_agent=/usr/lib/systemd/systemd-cgroups-agent,name=systemd 0 0
pstore /sys/fs/pstore pstore rw,seclabel,nosuid,nodev,noexec,relatime 0 0
bpf /sys/fs/bpf bpf rw,nosuid,nodev,noexec,relatime,mode=700 0 0
cgroup /sys/fs/cgroup/cpu,cpuacct cgroup rw,seclabel,nosuid,nodev,noexec,relatime,cpu,cpuacct 0 0
cgroup /sys/fs/cgroup/memory cgroup rw,seclabel,nosuid,nodev,noexec,relatime,memory 0 0
cgroup /sys/fs/cgroup/net_cls,net_prio cgroup rw,seclabel,nosuid,nodev,noexec,relatime,net_cls,net_prio 0 0
cgroup /sys/fs/cgroup/blkio cgroup rw,seclabel,nosuid,nodev,noexec,relatime,blkio 0 0
cgroup /sys/fs/cgroup/devices cgroup rw,seclabel,nosuid,nodev,noexec,relatime,devices 0 0
cgroup /sys/fs/cgroup/freezer cgroup rw,seclabel,nosuid,nodev,noexec,relatime,freezer 0 0
cgroup /sys/fs/cgroup/perf_event cgroup rw,seclabel,nosuid,nodev,noexec,relatime,perf_event 0 0
cgroup /sys/fs/cgroup/cpuset cgroup rw,seclabel,nosuid,nodev,noexec,relatime,cpuset 0 0
cgroup /sys/fs/cgroup/rdma cgroup rw,seclabel,nosuid,nodev,noexec,relatime,rdma 0 0
cgroup /sys/fs/cgroup/hugetlb cgroup rw,seclabel,nosuid,nodev,noexec,relatime,hugetlb 0 0
cgroup /sys/fs/cgroup/pids cgroup rw,seclabel,nosuid,nodev,noexec,relatime,pids 0 0
configfs /sys/kernel/config configfs rw,relatime 0 0
/dev/mapper/cl-root / xfs rw,seclabel,relatime,attr2,inode64,noquota 0 0
selinuxfs /sys/fs/selinux selinuxfs rw,relatime 0 0
systemd-1 /proc/sys/fs/binfmt_misc autofs rw,relatime,fd=36,pgrp=1,timeout=0,minproto=5,maxproto=5,direct,pipe_ino=17987 0 0
debugfs /sys/kernel/debug debugfs rw,seclabel,relatime 0 0
hugetlbfs /dev/hugepages hugetlbfs rw,seclabel,relatime,pagesize=2M 0 0
mqueue /dev/mqueue mqueue rw,seclabel,relatime 0 0
/dev/sda1 /boot ext4 rw,seclabel,relatime 0 0
tmpfs /run/user/1000 tmpfs rw,seclabel,nosuid,nodev,relatime,size=187352k,mode=700,uid=1000,gid=1000 0 0
```

# Issue description

Contaner cannot get ip address from host via dhcp. I can assign an ip address by hand, but the name resolution does not work either. It's a pain because tools as ping, dig, et al are not installed on container.

# Steps to reproduce

 1. dhclient eth0
 (No ip address assigned, se below, tcpdump and iptables output)
 2. ip addr add 10.0.3.2/24 dev eth0
 3. ip route  add default via 10.0.3.1 dev eth0 
 4. echo "nameserver 8.8.8.8" > /etc/resolv.conf    
 5.  apt update
 ```
Err:1 http://deb.debian.org/debian buster InRelease                  
  Temporary failure resolving 'deb.debian.org'
Err:2 http://security.debian.org/debian-security buster/updates InRelease
  Temporary failure resolving 'security.debian.org'
Reading package lists... Done                                        
Building dependency tree       
Reading state information... Done
All packages are up to date.
W: Failed to fetch http://deb.debian.org/debian/dists/buster/InRelease  Temporary failure resolving 'deb.debian.org'
W: Failed to fetch http://security.debian.org/debian-security/dists/buster/updates/InRelease  Temporary failure resolving 'security.debian.org'
W: Some index files failed to download. They have been ignored, or old ones used instead.
```

# Information to attach

 - [x] any relevant kernel output (`dmesg`)
 
 ```
  dmesg -T -l warn
[lun abr 27 07:14:51 2020] acpi PNP0A03:00: fail to add MMCONFIG information, can't access extended PCI configuration space under this bridge.
[lun abr 27 07:14:53 2020] e1000: E1000 MODULE IS NOT SUPPORTED
[lun abr 27 07:14:55 2020] systemd: 16 output lines suppressed due to ratelimiting
[lun abr 27 07:14:56 2020] systemd[1]: Failed to insert module 'ip_tables': Operation not permitted
```
 - [x] container log (The <log> file from running `lxc-start -n <c> -l TRACE -o <logfile> `)

```
awk '$4 ~ /ERROR|WARN/ { print }'  /tmp/lxc.log 
lxc-start debian-10 20200427113958.143 ERROR    start - start.c:proc_pidfd_open:1607 - Function not implemented - Failed to send signal through pidfd
lxc-start debian-10 20200427113958.156 WARN     start - start.c:lxc_spawn:1810 - Operation not permitted - Failed to allocate new network namespace id
```
Complete log at [lxc log](https://pastebin.com/6FDBjNe2)

 - [x] the containers configuration file

```
 cat /home/lxcman/.local/share/lxc/debian-10/config 
# Template used to create this container: /usr/share/lxc/templates/lxc-download
# Parameters passed to the template:
# For additional config options, please look at lxc.container.conf(5)

# Uncomment the following line to support nesting containers:
#lxc.include = /usr/share/lxc/config/nesting.conf
# (Be aware this has security implications)

# cgroupsv2 workaround?

# Distribution configuration
lxc.include = /usr/share/lxc/config/common.conf
lxc.include = /usr/share/lxc/config/userns.conf
lxc.arch = linux64

# Container specific configuration
lxc.idmap = u 0 100000 65535
lxc.idmap = g 0 100000 65535
lxc.cgroup.devices.allow =
lxc.cgroup.devices.deny =
lxc.init.cmd = /lib/systemd/systemd systemd.unified_cgroup_hierarchy=1
lxc.rootfs.path = dir:/home/lxcman/.local/share/lxc/debian-10/rootfs
lxc.uts.name = debian-10

# Network configuration
lxc.net.0.type = veth
lxc.net.0.link = lxcbr0
lxc.net.0.flags = up
lxc.net.0.hwaddr = 00:16:3e:6e:bc:5d
```
```
tcpdump -i lxcbr0
tcpdump: verbose output suppressed, use -v or -vv for full protocol decode
listening on lxcbr0, link-type EN10MB (Ethernet), capture size 262144 bytes
07:48:18.180357 IP 0.0.0.0.bootpc > 255.255.255.255.bootps: BOOTP/DHCP, Request from 00:16:3e:6e:bc:5d (oui Unknown), length 300
07:48:23.992018 IP 0.0.0.0.bootpc > 255.255.255.255.bootps: BOOTP/DHCP, Request from 00:16:3e:6e:bc:5d (oui Unknown), length 300
07:48:31.538757 IP 0.0.0.0.bootpc > 255.255.255.255.bootps: BOOTP/DHCP, Request from 00:16:3e:6e:bc:5d (oui Unknown), length 300
07:48:47.461236 IP 0.0.0.0.bootpc > 255.255.255.255.bootps: BOOTP/DHCP, Request from 00:16:3e:6e:bc:5d (oui Unknown), length 300
07:48:47.598733 IP 0.0.0.0.bootpc > 255.255.255.255.bootps: BOOTP/DHCP, Request from 00:16:3e:6e:bc:5d (oui Unknown), length 300
07:48:54.594481 IP 0.0.0.0.bootpc > 255.255.255.255.bootps: BOOTP/DHCP, Request from 00:16:3e:6e:bc:5d (oui Unknown), length 300
07:49:05.703699 IP 0.0.0.0.bootpc > 255.255.255.255.bootps: BOOTP/DHCP, Request from 00:16:3e:6e:bc:5d (oui Unknown), length 300
07:49:13.225545 IP 0.0.0.0.bootpc > 255.255.255.255.bootps: BOOTP/DHCP, Request from 00:16:3e:6e:bc:5d (oui Unknown), length 300
07:49:13.341790 IP 0.0.0.0.bootpc > 255.255.255.255.bootps: BOOTP/DHCP, Request from 00:16:3e:6e:bc:5d (oui Unknown), length 300
07:49:26.400654 IP 0.0.0.0.bootpc > 255.255.255.255.bootps: BOOTP/DHCP, Request from 00:16:3e:6e:bc:5d (oui Unknown), length 300
07:49:40.784608 IP 0.0.0.0.bootpc > 255.255.255.255.bootps: BOOTP/DHCP, Request from 00:16:3e:6e:bc:5d (oui Unknown), length 300
07:49:54.055363 IP6 fe80::216:3eff:fe6e:bc5d > ff02::2: ICMP6, router solicitation, length 16
```

```
 iptables -L -vn 
Chain INPUT (policy ACCEPT 2781 packets, 270K bytes)
 pkts bytes target     prot opt in     out     source               destination         
    0     0 ACCEPT     tcp  --  lxcbr0 *       0.0.0.0/0            0.0.0.0/0            tcp dpt:53
    0     0 ACCEPT     udp  --  lxcbr0 *       0.0.0.0/0            0.0.0.0/0            udp dpt:53
    0     0 ACCEPT     tcp  --  lxcbr0 *       0.0.0.0/0            0.0.0.0/0            tcp dpt:67
   46 15088 ACCEPT     udp  --  lxcbr0 *       0.0.0.0/0            0.0.0.0/0            udp dpt:67

Chain FORWARD (policy ACCEPT 0 packets, 0 bytes)
 pkts bytes target     prot opt in     out     source               destination         
    0     0 ACCEPT     all  --  *      lxcbr0  0.0.0.0/0            0.0.0.0/0           
   12   794 ACCEPT     all  --  lxcbr0 *       0.0.0.0/0            0.0.0.0/0           

Chain OUTPUT (policy ACCEPT 1536 packets, 266K bytes)
 pkts bytes target     prot opt in     out     source               destination 
 ```

Thanks in advance

**Comment by sebelk** [comment]
Well, the problem was firewallD on host, disabling and rebooting the host workarounded the issue...
